{
  "id": "dialogue.ferrum.nova.anomaly",
  "speaker": "character.engineer_nova",
  "station": "station.ferrum",
  "type": "investigative",
  "nodes": [
    {
      "id": "start",
      "line_key": "dlg.nova.anomaly.start",
      "conditions": [
        {
          "evidence": "evidence.route_correction_unsigned"
        }
      ],
      "choices": [
        {
          "id": "scan",
          "line_key": "choice.scan_anomaly",
          "next": "scan"
        }
      ]
    },
    {
      "id": "scan",
      "line_key": "dlg.nova.anomaly.scan",
      "terminal": true
    }
  ]
}