{
  "id": "dialogue.solaris.tidari.registry",
  "speaker": "character.dispatcher_tidari",
  "station": "station.solaris",
  "type": "investigative",
  "nodes": [
    {
      "id": "start",
      "line_key": "dlg.tidari.registry.start",
      "choices": [
        {
          "id": "report",
          "line_key": "choice.report_discrepancy",
          "next": "reported",
          "effects": [
            "consequence.tidari_registry_access"
          ]
        },
        {
          "id": "withhold",
          "line_key": "choice.withhold_discrepancy",
          "next": "withheld",
          "effects": [
            "consequence.private_discrepancy"
          ]
        }
      ]
    },
    {
      "id": "reported",
      "line_key": "dlg.tidari.registry.reported",
      "terminal": true
    },
    {
      "id": "withheld",
      "line_key": "dlg.tidari.registry.withheld",
      "terminal": true
    }
  ]
}