{
  "id": "dialogue.nova.nova.followup",
  "speaker": "character.engineer_nova",
  "station": "station.nova",
  "type": "revelation",
  "nodes": [
    {
      "id": "start",
      "line_key": "dlg.nova.sigma.start",
      "conditions": [
        {
          "evidence": "evidence.cross_source_pattern"
        }
      ],
      "choices": [
        {
          "id": "listen",
          "line_key": "choice.follow_signal",
          "next": "signal"
        }
      ]
    },
    {
      "id": "signal",
      "line_key": "dlg.nova.sigma.signal",
      "effects": [
        "consequence.sigma_lead_created"
      ],
      "terminal": true
    }
  ]
}