{
  "id": "dialogue.ferrum.nova.evidence_comparison",
  "speaker": "character.engineer_nova",
  "station": "station.ferrum",
  "type": "revelation",
  "nodes": [
    {
      "id": "start",
      "line_key": "dlg.nova.compare.start",
      "conditions": [
        {
          "all_evidence": [
            "evidence.route_correction_unsigned",
            "evidence.ferrum_scan_anomaly"
          ]
        }
      ],
      "choices": [
        {
          "id": "compare",
          "line_key": "choice.compare_sources",
          "next": "result"
        }
      ]
    },
    {
      "id": "result",
      "line_key": "dlg.nova.compare.result",
      "effects": [
        "consequence.cross_source_pattern_created"
      ],
      "terminal": true
    }
  ]
}